{
  "id": "20251129_030652_brainstorming_session",
  "timestamp": "2025-11-29T03:06:52.323460",
  "original_file": "data\\transcripts\\brainstorming_session.txt",
  "summary": "Cuộc họp động não tập trung vào việc tạo ra các tính năng mới cho nền tảng thương mại điện tử nhằm tăng cường tương tác người dùng và tỷ lệ chuyển đổi. Hơn 20 ý tưởng đã được đề xuất, với các tính năng được ưu tiên hàng đầu qua bình chọn bao gồm thanh toán một lần nhấp, đề xuất sản phẩm cá nhân hóa bằng ML và chatbot hỗ trợ khách hàng. Nhóm đã quyết định triển khai thanh toán một lần nhấp, chatbot và chương trình khách hàng thân thiết trong Giai đoạn 1 (Q1 2026) với ngân sách 500.000 USD, đồng thời lên kế hoạch cho các tính năng trung và dài hạn. Các tính năng rủi ro cao như blockchain và mạng xã hội bị hoãn vô thời hạn, và các hành động cụ thể đã được giao để bắt đầu triển khai các ưu tiên hàng đầu.",
  "topics": [
    {
      "topic": "Đề xuất và Thảo luận các Tính năng Mới",
      "description": "Cuộc họp tập trung vào việc động não và đề xuất nhiều tính năng mới cho nền tảng thương mại điện tử, bao gồm các ý tưởng về trải nghiệm người dùng (ví dụ: AR try-on, one-click checkout, AI stylist, gamification) và đổi mới kỹ thuật (ví dụ: đề xuất cá nhân hóa bằng ML, cập nhật tồn kho theo thời gian thực, ứng dụng di động)."
    },
    {
      "topic": "Đánh giá và Ưu tiên Tính năng",
      "description": "Các tính năng được đề xuất đã được đánh giá về các mối lo ngại và thách thức (ví dụ: tài nguyên phát triển, bảo mật, dữ liệu đào tạo). Sau đó, chúng được phân loại theo mức độ nỗ lực và tác động (Quick Wins, Medium Term, Long Term, Not Recommended) và trải qua phiên bỏ phiếu để xác định các ưu tiên hàng đầu, dẫn đến việc thiết lập lộ trình triển khai theo từng giai đoạn."
    },
    {
      "topic": "Quyết định Triển khai và Kế hoạch Hành động",
      "description": "Dựa trên quá trình ưu tiên, các quyết định cụ thể đã được đưa ra về việc triển khai các tính năng như one-click checkout, chatbot, chương trình khách hàng thân thiết (Giai đoạn 1), đề xuất ML (Giai đoạn 2), AR try-on (Giai đoạn 3). Các tính năng như blockchain và social feed bị hoãn vô thời hạn. Ngân sách $500K được phân bổ cho Giai đoạn 1 và các mục hành động cụ thể đã được giao cho các thành viên nhóm."
    }
  ],
  "action_items": [
    {
      "task": "Create detailed technical specification for one-click checkout",
      "assignee": "David",
      "deadline": "05/12/2025"
    },
    {
      "task": "Research and evaluate chatbot solutions",
      "assignee": "Sarah",
      "deadline": "03/12/2025"
    },
    {
      "task": "Design loyalty program structure and rewards",
      "assignee": "Lisa",
      "deadline": "08/12/2025"
    },
    {
      "task": "Prepare ML recommendation engine proposal",
      "assignee": "Kevin",
      "deadline": "10/12/2025"
    },
    {
      "task": "Conduct user research on AR try-on interest",
      "assignee": "Mike",
      "deadline": "15/12/2025"
    },
    {
      "task": "Create project timeline and resource allocation",
      "assignee": "Jennifer",
      "deadline": "02/12/2025"
    },
    {
      "task": "Get executive approval for $500K budget",
      "assignee": "Jennifer",
      "deadline": "12/12/2025"
    },
    {
      "task": "Set up weekly progress meetings for Phase 1",
      "assignee": "Jennifer",
      "deadline": "01/12/2025"
    }
  ],
  "decisions": [
    {
      "decision": "Implement one-click checkout as top priority for Q1 2026",
      "context": "Highest votes and directly impacts conversion rate. Estimated 15-20% increase in sales."
    },
    {
      "decision": "Start ML recommendation engine development immediately",
      "context": "Requires 3-4 months of data collection and model training. High impact on user engagement."
    },
    {
      "decision": "Launch basic chatbot by end of Q1 2026",
      "context": "Can use existing solutions like Intercom or Zendesk. Quick win for customer satisfaction."
    },
    {
      "decision": "Postpone blockchain and social feed features indefinitely",
      "context": "High risk, unclear ROI, and significant technical challenges."
    },
    {
      "decision": "Allocate $500K budget for Phase 1 features",
      "context": "Based on engineering estimates and vendor quotes."
    }
  ],
  "metadata": {
    "language": "vi",
    "meeting_type": "brainstorming",
    "specialized_data": {
      "ideas": {
        "ideas": [
          {
            "idea": "Add AR (Augmented Reality) try-on for clothes and accessories Proposed by: Mike (Designer) Category: UI/UX Idea: Implement one-click checkout like Amazon Proposed by: Sarah (Product) Category: Features Idea: Create a personal stylist AI that recommends outfits Proposed by: David (Engineering) Category: Features Idea: Add live shopping events with influencers Proposed by: Lisa (Marketing) Category: Business Idea: Implement a virtual fitting room with body measurements Proposed by: Mike (Designer) Category: UI/UX What if we add a social feed where users can share their purchases? Suggested by: Tom (Product) How about gamification with points and rewards for purchases? Suggested by: Emma (Product) I propose we add voice search for products Suggested by: Kevin (Engineering) Let's create a subscription box service for regular customers Suggested by: Lisa (Marketing) === IDEATION ROUND 2: Technical Innovations === Idea: Use machine learning for personalized product recommendations Category: Technical Idea: Implement real-time inventory updates across all channels Category: Technical Idea: Add blockchain for supply chain transparency Category: Technical Idea: Create a mobile app with offline browsing capability Category: Technical Idea: Implement chatbot for 24/7 customer support Category: Features Idea: Add video reviews and unboxing content Category: Features Idea: Create a loyalty program with tiered benefits Category: Business === CONCERNS AND CHALLENGES === Concern: AR try-on requires significant development resources and may not work on all devices Raised by: David (Engineering) Concern: One-click checkout has security implications and PCI compliance requirements Raised by: Kevin (Engineering) Challenge: AI stylist needs massive training data and may give poor recommendations initially Raised by: Sarah (Product) Concern: Live shopping events require partnerships with influencers and streaming infrastructure Raised by: Lisa (Marketing) Problem: Virtual fitting room accuracy depends on user providing correct measurements Raised by: Mike (Designer) Risk: Social feed could lead to negative reviews being prominently displayed Raised by: Tom (Product) Challenge: Voice search accuracy varies by accent and language Raised by: Kevin (Engineering) Concern: Subscription boxes have high logistics costs and inventory management complexity Raised by: Emma (Product) === CATEGORIZATION === Quick Wins (Low effort, High impact): - Chatbot for customer support - Video reviews and unboxing - Loyalty program - Voice search Medium Term (Medium effort, High impact): - One-click checkout - Personalized recommendations - Mobile app with offline mode - Gamification with rewards Long Term (High effort, High impact): - AR try-on - AI personal stylist - Virtual fitting room - Live shopping events Not Recommended (High effort, Low impact): - Blockchain for supply chain - Social feed (too risky) === VOTING SESSION === Each participant gets 3 votes for their top priorities: Results: 1",
            "category": "general"
          },
          {
            "idea": "E-commerce Platform New Features Facilitator: Jennifer Lee Date: November 29, 2025 Duration: 2 hours Participants: Product Team (8 people), Design Team (4 people), Engineering Team (6 people) === OPENING === Jennifer: Welcome everyone! Today we're brainstorming new features for our e-commerce platform. Our goal is to increase user engagement and conversion rates. No idea is too crazy - let's think big! Ground Rules: - All ideas are welcome - No criticism during ideation phase - Build on others' ideas - Quantity over quality initially === IDEATION ROUND 1: User Experience === Idea: Add AR (Augmented Reality) try-on for clothes and accessories Proposed by: Mike (Designer) Category: UI/UX Idea: Implement one-click checkout like Amazon Proposed by: Sarah (Product) Category: Features Idea: Create a personal stylist AI that recommends outfits Proposed by: David (Engineering) Category: Features Idea: Add live shopping events with influencers Proposed by: Lisa (Marketing) Category: Business Idea: Implement a virtual fitting room with body measurements Proposed by: Mike (Designer) Category: UI/UX What if we add a social feed where users can share their purchases? Suggested by: Tom (Product) How about gamification with points and rewards for purchases? Suggested by: Emma (Product) I propose we add voice search for products Suggested by: Kevin (Engineering) Let's create a subscription box service for regular customers Suggested by: Lisa (Marketing) === IDEATION ROUND 2: Technical Innovations === Idea: Use machine learning for personalized product recommendations Category: Technical Idea: Implement real-time inventory updates across all channels Category: Technical Idea: Add blockchain for supply chain transparency Category: Technical Idea: Create a mobile app with offline browsing capability Category: Technical Idea: Implement chatbot for 24/7 customer support Category: Features Idea: Add video reviews and unboxing content Category: Features Idea: Create a loyalty program with tiered benefits Category: Business === CONCERNS AND CHALLENGES === Concern: AR try-on requires significant development resources and may not work on all devices Raised by: David (Engineering) Concern: One-click checkout has security implications and PCI compliance requirements Raised by: Kevin (Engineering) Challenge: AI stylist needs massive training data and may give poor recommendations initially Raised by: Sarah (Product) Concern: Live shopping events require partnerships with influencers and streaming infrastructure Raised by: Lisa (Marketing) Problem: Virtual fitting room accuracy depends on user providing correct measurements Raised by: Mike (Designer) Risk: Social feed could lead to negative reviews being prominently displayed Raised by: Tom (Product) Challenge: Voice search accuracy varies by accent and language Raised by: Kevin (Engineering) Concern: Subscription boxes have high logistics costs and inventory management complexity Raised by: Emma (Product) === CATEGORIZATION === Quick Wins (Low effort, High impact): - Chatbot for customer support - Video reviews and unboxing - Loyalty program - Voice search Medium Term (Medium effort, High impact): - One-click checkout - Personalized recommendations - Mobile app with offline mode - Gamification with rewards Long Term (High effort, High impact): - AR try-on - AI personal stylist - Virtual fitting room - Live shopping events Not Recommended (High effort, Low impact): - Blockchain for supply chain - Social feed (too risky) === VOTING SESSION === Each participant gets 3 votes for their top priorities: Results: 1. One-click checkout: 12 votes ⭐ 2. Personalized recommendations (ML): 11 votes ⭐ 3. Chatbot for customer support: 9 votes 4. AR try-on: 8 votes 5. Loyalty program: 7 votes 6. Mobile app with offline mode: 6 votes 7. Video reviews: 5 votes 8. Gamification: 4 votes 9. Voice search: 3 votes 10. Live shopping events: 2 votes === PRIORITIZATION === Jennifer: Based on voting and feasibility analysis, here's our priority order: Phase 1 (Q1 2026): - One-click checkout - Chatbot for customer support - Loyalty program Phase 2 (Q2 2026): - Personalized recommendations with ML - Video reviews and unboxing - Mobile app development starts Phase 3 (Q3-Q4 2026): - AR try-on (pilot with selected products) - Gamification features - Voice search === DECISIONS MADE === Decision: Implement one-click checkout as top priority for Q1 2026 Context: Highest votes and directly impacts conversion rate. Estimated 15-20% increase in sales. Decision: Start ML recommendation engine development immediately Context: Requires 3-4 months of data collection and model training. High impact on user engagement. Decision: Launch basic chatbot by end of Q1 2026 Context: Can use existing solutions like Intercom or Zendesk. Quick win for customer satisfaction. Decision: Postpone blockchain and social feed features indefinitely Context: High risk, unclear ROI, and significant technical challenges. Decision: Allocate $500K budget for Phase 1 features Context: Based on engineering estimates and vendor quotes. === ACTION ITEMS === Action Items: - Create detailed technical specification for one-click checkout (David, 05/12/2025) - Research and evaluate chatbot solutions (Sarah, 03/12/2025) - Design loyalty program structure and rewards (Lisa, 08/12/2025) - Prepare ML recommendation engine proposal (Kevin, 10/12/2025) - Conduct user research on AR try-on interest (Mike, 15/12/2025) - Create project timeline and resource allocation (Jennifer, 02/12/2025) - Get executive approval for $500K budget (Jennifer, 12/12/2025) - Set up weekly progress meetings for Phase 1 (Jennifer, 01/12/2025) === CLOSING === Jennifer: Great session everyone! We generated 20+ ideas and have a clear roadmap. Let's execute Phase 1 and prove the value before moving to more ambitious features. Next Brainstorming: Feature Refinement Workshop - December 20, 2025 Innovation Score: 8.5/10 Participation Rate: 100% Ideas Generated: 23 Ideas Selected: 8",
            "category": "general"
          }
        ]
      },
      "categorized_ideas": {
        "categorized_ideas": {
          "UI/UX": [
            {
              "idea": "Add AR (Augmented Reality) try-on for clothes and accessories Proposed by: Mike (Designer) Category: UI/UX Idea: Implement one-click checkout like Amazon Proposed by: Sarah (Product) Category: Features Idea: Create a personal stylist AI that recommends outfits Proposed by: David (Engineering) Category: Features Idea: Add live shopping events with influencers Proposed by: Lisa (Marketing) Category: Business Idea: Implement a virtual fitting room with body measurements Proposed by: Mike (Designer) Category: UI/UX What if we add a social feed where users can share their purchases? Suggested by: Tom (Product) How about gamification with points and rewards for purchases? Suggested by: Emma (Product) I propose we add voice search for products Suggested by: Kevin (Engineering) Let's create a subscription box service for regular customers Suggested by: Lisa (Marketing) === IDEATION ROUND 2: Technical Innovations === Idea: Use machine learning for personalized product recommendations Category: Technical Idea: Implement real-time inventory updates across all channels Category: Technical Idea: Add blockchain for supply chain transparency Category: Technical Idea: Create a mobile app with offline browsing capability Category: Technical Idea: Implement chatbot for 24/7 customer support Category: Features Idea: Add video reviews and unboxing content Category: Features Idea: Create a loyalty program with tiered benefits Category: Business === CONCERNS AND CHALLENGES === Concern: AR try-on requires significant development resources and may not work on all devices Raised by: David (Engineering) Concern: One-click checkout has security implications and PCI compliance requirements Raised by: Kevin (Engineering) Challenge: AI stylist needs massive training data and may give poor recommendations initially Raised by: Sarah (Product) Concern: Live shopping events require partnerships with influencers and streaming infrastructure Raised by: Lisa (Marketing) Problem: Virtual fitting room accuracy depends on user providing correct measurements Raised by: Mike (Designer) Risk: Social feed could lead to negative reviews being prominently displayed Raised by: Tom (Product) Challenge: Voice search accuracy varies by accent and language Raised by: Kevin (Engineering) Concern: Subscription boxes have high logistics costs and inventory management complexity Raised by: Emma (Product) === CATEGORIZATION === Quick Wins (Low effort, High impact): - Chatbot for customer support - Video reviews and unboxing - Loyalty program - Voice search Medium Term (Medium effort, High impact): - One-click checkout - Personalized recommendations - Mobile app with offline mode - Gamification with rewards Long Term (High effort, High impact): - AR try-on - AI personal stylist - Virtual fitting room - Live shopping events Not Recommended (High effort, Low impact): - Blockchain for supply chain - Social feed (too risky) === VOTING SESSION === Each participant gets 3 votes for their top priorities: Results: 1",
              "category": "general"
            },
            {
              "idea": "E-commerce Platform New Features Facilitator: Jennifer Lee Date: November 29, 2025 Duration: 2 hours Participants: Product Team (8 people), Design Team (4 people), Engineering Team (6 people) === OPENING === Jennifer: Welcome everyone! Today we're brainstorming new features for our e-commerce platform. Our goal is to increase user engagement and conversion rates. No idea is too crazy - let's think big! Ground Rules: - All ideas are welcome - No criticism during ideation phase - Build on others' ideas - Quantity over quality initially === IDEATION ROUND 1: User Experience === Idea: Add AR (Augmented Reality) try-on for clothes and accessories Proposed by: Mike (Designer) Category: UI/UX Idea: Implement one-click checkout like Amazon Proposed by: Sarah (Product) Category: Features Idea: Create a personal stylist AI that recommends outfits Proposed by: David (Engineering) Category: Features Idea: Add live shopping events with influencers Proposed by: Lisa (Marketing) Category: Business Idea: Implement a virtual fitting room with body measurements Proposed by: Mike (Designer) Category: UI/UX What if we add a social feed where users can share their purchases? Suggested by: Tom (Product) How about gamification with points and rewards for purchases? Suggested by: Emma (Product) I propose we add voice search for products Suggested by: Kevin (Engineering) Let's create a subscription box service for regular customers Suggested by: Lisa (Marketing) === IDEATION ROUND 2: Technical Innovations === Idea: Use machine learning for personalized product recommendations Category: Technical Idea: Implement real-time inventory updates across all channels Category: Technical Idea: Add blockchain for supply chain transparency Category: Technical Idea: Create a mobile app with offline browsing capability Category: Technical Idea: Implement chatbot for 24/7 customer support Category: Features Idea: Add video reviews and unboxing content Category: Features Idea: Create a loyalty program with tiered benefits Category: Business === CONCERNS AND CHALLENGES === Concern: AR try-on requires significant development resources and may not work on all devices Raised by: David (Engineering) Concern: One-click checkout has security implications and PCI compliance requirements Raised by: Kevin (Engineering) Challenge: AI stylist needs massive training data and may give poor recommendations initially Raised by: Sarah (Product) Concern: Live shopping events require partnerships with influencers and streaming infrastructure Raised by: Lisa (Marketing) Problem: Virtual fitting room accuracy depends on user providing correct measurements Raised by: Mike (Designer) Risk: Social feed could lead to negative reviews being prominently displayed Raised by: Tom (Product) Challenge: Voice search accuracy varies by accent and language Raised by: Kevin (Engineering) Concern: Subscription boxes have high logistics costs and inventory management complexity Raised by: Emma (Product) === CATEGORIZATION === Quick Wins (Low effort, High impact): - Chatbot for customer support - Video reviews and unboxing - Loyalty program - Voice search Medium Term (Medium effort, High impact): - One-click checkout - Personalized recommendations - Mobile app with offline mode - Gamification with rewards Long Term (High effort, High impact): - AR try-on - AI personal stylist - Virtual fitting room - Live shopping events Not Recommended (High effort, Low impact): - Blockchain for supply chain - Social feed (too risky) === VOTING SESSION === Each participant gets 3 votes for their top priorities: Results: 1. One-click checkout: 12 votes ⭐ 2. Personalized recommendations (ML): 11 votes ⭐ 3. Chatbot for customer support: 9 votes 4. AR try-on: 8 votes 5. Loyalty program: 7 votes 6. Mobile app with offline mode: 6 votes 7. Video reviews: 5 votes 8. Gamification: 4 votes 9. Voice search: 3 votes 10. Live shopping events: 2 votes === PRIORITIZATION === Jennifer: Based on voting and feasibility analysis, here's our priority order: Phase 1 (Q1 2026): - One-click checkout - Chatbot for customer support - Loyalty program Phase 2 (Q2 2026): - Personalized recommendations with ML - Video reviews and unboxing - Mobile app development starts Phase 3 (Q3-Q4 2026): - AR try-on (pilot with selected products) - Gamification features - Voice search === DECISIONS MADE === Decision: Implement one-click checkout as top priority for Q1 2026 Context: Highest votes and directly impacts conversion rate. Estimated 15-20% increase in sales. Decision: Start ML recommendation engine development immediately Context: Requires 3-4 months of data collection and model training. High impact on user engagement. Decision: Launch basic chatbot by end of Q1 2026 Context: Can use existing solutions like Intercom or Zendesk. Quick win for customer satisfaction. Decision: Postpone blockchain and social feed features indefinitely Context: High risk, unclear ROI, and significant technical challenges. Decision: Allocate $500K budget for Phase 1 features Context: Based on engineering estimates and vendor quotes. === ACTION ITEMS === Action Items: - Create detailed technical specification for one-click checkout (David, 05/12/2025) - Research and evaluate chatbot solutions (Sarah, 03/12/2025) - Design loyalty program structure and rewards (Lisa, 08/12/2025) - Prepare ML recommendation engine proposal (Kevin, 10/12/2025) - Conduct user research on AR try-on interest (Mike, 15/12/2025) - Create project timeline and resource allocation (Jennifer, 02/12/2025) - Get executive approval for $500K budget (Jennifer, 12/12/2025) - Set up weekly progress meetings for Phase 1 (Jennifer, 01/12/2025) === CLOSING === Jennifer: Great session everyone! We generated 20+ ideas and have a clear roadmap. Let's execute Phase 1 and prove the value before moving to more ambitious features. Next Brainstorming: Feature Refinement Workshop - December 20, 2025 Innovation Score: 8.5/10 Participation Rate: 100% Ideas Generated: 23 Ideas Selected: 8",
              "category": "general"
            }
          ],
          "Features": [],
          "Technical": [],
          "Business": [],
          "Other": []
        }
      },
      "concerns": {
        "concerns": []
      }
    }
  }
}